DEPLOY_ID,DEPLOY_NAME,DEPLOY_TYPE,DEPLOY_STATUS,PLANNED_DT,DEPLOYED_DT,OWNER_TEAM,DESC
DEP_20260711_001,카테고리 한글라벨 적용 Streamlit 재배포,정기,배포완료,2026-07-11,2026-07-11,정보화기획팀,GitHub push 후 Streamlit Community Cloud 자동 재배포
DEP_20260711_002,구성관리 CI 등록/조회 CRUD 배포,정기,배포완료,2026-07-11,2026-07-11,정보화기획팀,Streamlit Cloud 자동 재배포. pages/3_구성관리.py CI 추가/삭제 기능 배포
DEP_20260711_003,변경관리 CRUD 배포,정기,배포완료,2026-07-11,2026-07-11,정보화기획팀,Streamlit Cloud 자동 재배포. pages/1_변경관리.py 등록/조회 화면 배포(WBS #1 100% 완료)
DEP_20260711_004,좌측 메뉴-폴더 구조 정합화 배포,정기,배포완료,2026-07-11,2026-07-11,정보화기획팀,Streamlit Cloud 자동 재배포. 신규 도메인 10개(문제~백업관리) 조회 페이지 및 사이드바 재정렬 배포
DEP_20260711_005,변경관리 CRUD + 좌측메뉴 폴더구조 정합화 통합 배포,정기,배포완료,2026-07-11,2026-07-11,정보화기획팀,"git push origin main으로 4개 커밋(13개 도메인 재편, 변경관리 CRUD, 좌측메뉴 정합화, 실데이터 등록)을 한 번에 반영. Streamlit Community Cloud는 GitHub push 시 자동 재배포되나, 앱이 유휴 상태(sleep)로 전환돼 있어 헤드리스 curl 확인 시 share.streamlit.io 로그인/웨이크업 리다이렉트(303)만 확인됨 — 실제 화면 반영은 브라우저에서 직접 접속해 깨운 뒤 육안 확인 필요."
